{
  "config_revision": "1",
  "config_sha256": "dcdc556ee2e895c60860d39871999d4ac014dee1d42d4ff929f72e74a6436431",
  "frozen_factors": {
    "appearance_profile_id": "red_default_v1",
    "camera_profile_id": "front_rgbd_640x360_v1",
    "controller_profile_id": "hybrid_rmpflow_lula_ik_cylinder_v1",
    "lighting_profile_id": "distant_1000_v1",
    "material_id": "high_friction_cylinder_v1",
    "object_dimensions_m": [
      0.07,
      0.07,
      0.12
    ],
    "object_height_m": 0.12,
    "object_initial_z_m": 0.5,
    "object_mass_kg": 0.08,
    "object_radius_m": 0.035,
    "object_shape": "cylinder",
    "object_yaw_degrees": 0.0,
    "physics_profile_id": "physx_contact_pickup_v1",
    "pickup_overrides": {
      "bilateral_contact_min_finger_position_radians": -0.001,
      "bilateral_force_backoff_radians": 1e-05,
      "bilateral_force_limit_newtons": 1000.0,
      "bilateral_hold_max_force_newtons": 1000.0,
      "dynamic_friction": 2.0,
      "finger_contact_max_effort": 20.0,
      "grasp_aperture_bias_xy": [
        -0.0015,
        0.001
      ],
      "grasp_descent_max_xy_error": 0.006,
      "grasp_height_offset_meters": -0.05,
      "grasp_tracking_max_finger_z_skew": 0.015,
      "grasp_tracking_max_xy_error": 0.006,
      "gripper_force_max_preload_error_radians": 0.08,
      "static_friction": 2.5,
      "unilateral_force_backoff_radians": 1e-05,
      "unilateral_force_limit_newtons": 1000.0,
      "unilateral_recenter_enabled": true,
      "unilateral_recenter_max_correction": 0.003,
      "unilateral_recenter_persistence_frames": 12,
      "unilateral_recenter_step": 0.0001
    },
    "recording_profile_id": "farpoint_multimodal_v1",
    "robot_pose_profile_id": "ur10e_tabletop_v1",
    "target_position_m": [
      0.96,
      -0.03,
      0.42
    ]
  },
  "grid": {
    "candidates_per_cell": 6,
    "columns": 5,
    "interior_fraction": [
      0.1,
      0.9
    ],
    "rows": 5,
    "x_bounds_m": [
      0.84,
      1.1
    ],
    "y_bounds_m": [
      0.18,
      0.38
    ]
  },
  "language_instruction": "Use calibrated RGB-D observations to locate the cylinder and target, grasp the cylinder through Robotiq finger contact and friction only, and place it inside the target zone.",
  "plan_id": "farpoint_v0_0_1_cylinder_position",
  "plan_sha256": "f8151bb79e90bc2d5638c0157e293fd137edabcb4cd73418db74a327a032c7b3",
  "planner_revision": "shape-position-grid-v1",
  "planner_sha256": "8495ff9976f99843f10f24cb3eb20dbdf25783edc28577e5791b2ca7b6996684",
  "schema_version": "farpoint.position-plan.v1",
  "task_id": "isaac_perception_contact_cylinder_scene",
  "task_template_id": "isaac_perception_contact_scene",
  "trials": [
    {
      "cell_id": "r00_c00",
      "column": 0,
      "object_position_xy_m": [
        0.845437112,
        0.203366952
      ],
      "row": 0,
      "seed": 6910026524040423266,
      "seed_material": {
        "cell_column": 0,
        "cell_row": 0,
        "plan_id": "farpoint_v0_0_1_cylinder_position",
        "schema_version": "farpoint.position-plan.v1",
        "slot": 0
      },
      "slot": 0,
      "split": "validation",
      "trial_id": "cylinder_r00_c00_s00",
      "variation_id": "cylinder_position_r00_c00_s00"
    },
    {
      "cell_id": "r00_c01",
      "column": 1,
      "object_position_xy_m": [
        0.91135332,
        0.196414085
      ],
      "row": 0,
      "seed": 9046697525975385323,
      "seed_material": {
        "cell_column": 1,
        "cell_row": 0,
        "plan_id": "farpoint_v0_0_1_cylinder_position",
        "schema_version": "farpoint.position-plan.v1",
        "slot": 0
      },
      "slot": 0,
      "split": "train",
      "trial_id": "cylinder_r00_c01_s00",
      "variation_id": "cylinder_position_r00_c01_s00"
    },
    {
      "cell_id": "r00_c02",
      "column": 2,
      "object_position_xy_m": [
        0.952477123,
        0.19930501
      ],
      "row": 0,
      "seed": 3734411682567765180,
      "seed_material": {
        "cell_column": 2,
        "cell_row": 0,
        "plan_id": "farpoint_v0_0_1_cylinder_position",
        "schema_version": "farpoint.position-plan.v1",
        "slot": 0
      },
      "slot": 0,
      "split": "test",
      "trial_id": "cylinder_r00_c02_s00",
      "variation_id": "cylinder_position_r00_c02_s00"
    },
    {
      "cell_id": "r00_c03",
      "column": 3,
      "object_position_xy_m": [
        1.011007897,
        0.197529309
      ],
      "row": 0,
      "seed": 6920663956149606043,
      "seed_material": {
        "cell_column": 3,
        "cell_row": 0,
        "plan_id": "farpoint_v0_0_1_cylinder_position",
        "schema_version": "farpoint.position-plan.v1",
        "slot": 0
      },
      "slot": 0,
      "split": "train",
      "trial_id": "cylinder_r00_c03_s00",
      "variation_id": "cylinder_position_r00_c03_s00"
    },
    {
      "cell_id": "r00_c04",
      "column": 4,
      "object_position_xy_m": [
        1.084033963,
        0.187986589
      ],
      "row": 0,
      "seed": 582985676772217135,
      "seed_material": {
        "cell_column": 4,
        "cell_row": 0,
        "plan_id": "farpoint_v0_0_1_cylinder_position",
        "schema_version": "farpoint.position-plan.v1",
        "slot": 0
      },
      "slot": 0,
      "split": "validation",
      "trial_id": "cylinder_r00_c04_s00",
      "variation_id": "cylinder_position_r00_c04_s00"
    },
    {
      "cell_id": "r01_c00",
      "column": 0,
      "object_position_xy_m": [
        0.851036801,
        0.225548237
      ],
      "row": 1,
      "seed": 6150893885722087935,
      "seed_material": {
        "cell_column": 0,
        "cell_row": 1,
        "plan_id": "farpoint_v0_0_1_cylinder_position",
        "schema_version": "farpoint.position-plan.v1",
        "slot": 0
      },
      "slot": 0,
      "split": "train",
      "trial_id": "cylinder_r01_c00_s00",
      "variation_id": "cylinder_position_r01_c00_s00"
    },
    {
      "cell_id": "r01_c01",
      "column": 1,
      "object_position_xy_m": [
        0.925991949,
        0.233627175
      ],
      "row": 1,
      "seed": 8552695541462866972,
      "seed_material": {
        "cell_column": 1,
        "cell_row": 1,
        "plan_id": "farpoint_v0_0_1_cylinder_position",
        "schema_version": "farpoint.position-plan.v1",
        "slot": 0
      },
      "slot": 0,
      "split": "train",
      "trial_id": "cylinder_r01_c01_s00",
      "variation_id": "cylinder_position_r01_c01_s00"
    },
    {
      "cell_id": "r01_c02",
      "column": 2,
      "object_position_xy_m": [
        0.97460769,
        0.232436691
      ],
      "row": 1,
      "seed": 2660552185624246541,
      "seed_material": {
        "cell_column": 2,
        "cell_row": 1,
        "plan_id": "farpoint_v0_0_1_cylinder_position",
        "schema_version": "farpoint.position-plan.v1",
        "slot": 0
      },
      "slot": 0,
      "split": "train",
      "trial_id": "cylinder_r01_c02_s00",
      "variation_id": "cylinder_position_r01_c02_s00"
    },
    {
      "cell_id": "r01_c03",
      "column": 3,
      "object_position_xy_m": [
        1.028559467,
        0.241730328
      ],
      "row": 1,
      "seed": 5594109676537239864,
      "seed_material": {
        "cell_column": 3,
        "cell_row": 1,
        "plan_id": "farpoint_v0_0_1_cylinder_position",
        "schema_version": "farpoint.position-plan.v1",
        "slot": 0
      },
      "slot": 0,
      "split": "train",
      "trial_id": "cylinder_r01_c03_s00",
      "variation_id": "cylinder_position_r01_c03_s00"
    },
    {
      "cell_id": "r01_c04",
      "column": 4,
      "object_position_xy_m": [
        1.061568966,
        0.239791433
      ],
      "row": 1,
      "seed": 8025241901029768018,
      "seed_material": {
        "cell_column": 4,
        "cell_row": 1,
        "plan_id": "farpoint_v0_0_1_cylinder_position",
        "schema_version": "farpoint.position-plan.v1",
        "slot": 0
      },
      "slot": 0,
      "split": "train",
      "trial_id": "cylinder_r01_c04_s00",
      "variation_id": "cylinder_position_r01_c04_s00"
    },
    {
      "cell_id": "r02_c00",
      "column": 0,
      "object_position_xy_m": [
        0.87089917,
        0.26495682
      ],
      "row": 2,
      "seed": 1958510152186458689,
      "seed_material": {
        "cell_column": 0,
        "cell_row": 2,
        "plan_id": "farpoint_v0_0_1_cylinder_position",
        "schema_version": "farpoint.position-plan.v1",
        "slot": 0
      },
      "slot": 0,
      "split": "test",
      "trial_id": "cylinder_r02_c00_s00",
      "variation_id": "cylinder_position_r02_c00_s00"
    },
    {
      "cell_id": "r02_c01",
      "column": 1,
      "object_position_xy_m": [
        0.902026308,
        0.27499595
      ],
      "row": 2,
      "seed": 2395122331469639347,
      "seed_material": {
        "cell_column": 1,
        "cell_row": 2,
        "plan_id": "farpoint_v0_0_1_cylinder_position",
        "schema_version": "farpoint.position-plan.v1",
        "slot": 0
      },
      "slot": 0,
      "split": "train",
      "trial_id": "cylinder_r02_c01_s00",
      "variation_id": "cylinder_position_r02_c01_s00"
    },
    {
      "cell_id": "r02_c02",
      "column": 2,
      "object_position_xy_m": [
        0.958566687,
        0.289542597
      ],
      "row": 2,
      "seed": 5934219967964824602,
      "seed_material": {
        "cell_column": 2,
        "cell_row": 2,
        "plan_id": "farpoint_v0_0_1_cylinder_position",
        "schema_version": "farpoint.position-plan.v1",
        "slot": 0
      },
      "slot": 0,
      "split": "test",
      "trial_id": "cylinder_r02_c02_s00",
      "variation_id": "cylinder_position_r02_c02_s00"
    },
    {
      "cell_id": "r02_c03",
      "column": 3,
      "object_position_xy_m": [
        1.016405142,
        0.293339119
      ],
      "row": 2,
      "seed": 4166547241410254362,
      "seed_material": {
        "cell_column": 3,